{
  "schema_version": "agentflow.project_index.module.v1",
  "module_id": "auth",
  "name": "Authentication",
  "summary": "Authentication service and tests.",
  "boundaries": {
    "paths": ["src/auth/**", "tests/auth/**"]
  },
  "entrypoints": ["src/auth/service.ts"],
  "test_files": ["tests/auth/service.test.ts"],
  "dependencies": [
    {
      "kind": "runtime",
      "target": "node",
      "summary": "Runs in Node.js."
    }
  ],
  "related_commands": ["test", "typecheck"]
}
